{
  "businessCreationDate": "2016-01-02T12:22:50Z",
  "creatorPerson": {
    "ID": "100",
    "firstName": "Frits",
    "familyName": "Spits"
  },
  "customerProductReference": "CUSTPROD",
  "dropboxReplenishmentRequestRequested": false,
  "fixedPrice": false,
  "packaging": {
    "ID": "74",
    "description": "plastic bag 25 kg"
  },
  "product": {
    "ID": "123",
    "brandName": "DOW",
    "color": {
      "ID": "123",
      "description": "BLACK"
    },
    "grade": "LDPE",
    "producerColorCode": "DARK"
  },
  "printedProductDescription": "This is my changed product description",
  "quantity": {
    "quantity": 750,
    "unitCode": "kg"
  },
  "sample": false,
  "unitPrice": {
    "amount": 1.25,
    "unitCode": "kg"
  }
}